{
  "authoritative_at": "2026-08-09T11:05:00Z",
  "authority": {
    "type": "human_approved"
  },
  "id": "rcpt_123_v2",
  "issued_at": "2026-08-09T11:06:00Z",
  "key": "architecture.database",
  "kind": "decision",
  "lifecycle": "active",
  "memory_id": "mem_123",
  "memory_version": 2,
  "provenance": {
    "ref": "prov_123",
    "type": "governed_record"
  },
  "relations": [
    {
      "memory_id": "mem_123",
      "memory_version": 1,
      "type": "supersedes"
    }
  ],
  "schema_version": "1",
  "scope": {
    "id": "project_abc",
    "kind": "project"
  }
}
